{
  "schema_version": "1.0",
  "id": "CASE-INTEGRATION-THIRD-PARTY-SECRET-VALIDATION-001",
  "title": "第三方服务 Secret 的等长负控验证",
  "summary": "匿名迁移案例契约：先区分公开 AppKey 与服务端 Secret，再固定合成目标和请求体，对候选与等长错误材料执行官方只读或 validate-only 差分；它不包含秘密，也不代表已确认控制能力。",
  "scene": "third-party-server-secret-validation-contract",
  "target_type": [
    "artifact",
    "mobile-api",
    "third-party-api"
  ],
  "technology": [
    "hmac",
    "oauth",
    "provider-api"
  ],
  "business_object": [
    "application-identity",
    "integration",
    "provider-credential"
  ],
  "operation_type": [
    "authenticate",
    "read"
  ],
  "trust_boundary": [
    "public-artifact-to-provider-control-plane",
    "server-secret-to-application-identity"
  ],
  "observed_signal": [
    "candidate-server-secret",
    "equal-length-wrong-secret-control",
    "official-validation-endpoint"
  ],
  "root_cause_family": "third_party_server_secret_exposure",
  "evidence_mode": [
    "credential-classification",
    "provider-response-differential",
    "restricted-material-reference"
  ],
  "required_material": [
    "candidate-secret-fingerprint-in-restricted-evidence",
    "confirmed-application-identity",
    "official-readonly-or-validate-only-endpoint"
  ],
  "matched_tactics": [
    "INTEGRATION-THIRD-PARTY-SECRET-VALIDATION-001"
  ],
  "effective_paths": [
    {
      "id": "credential-classification-first",
      "description": "先依据官方语义和使用位置区分公开客户端标识与服务端认证秘密。"
    },
    {
      "id": "equal-length-single-variable-control",
      "description": "固定应用身份、合成目标、请求体和时间窗口，只替换候选与等长同格式错误材料。"
    },
    {
      "id": "official-no-side-effect-check",
      "description": "只使用官方认证、只读或 validate-only 端点，并仅记录业务成功语义、长度与指纹。"
    }
  ],
  "ineffective_paths": [
    {
      "id": "public-app-key-as-secret",
      "description": "公开 AppKey、client identifier 或 SDK 配置不能按服务端 Secret 评级。"
    },
    {
      "id": "same-shape-provider-error",
      "description": "候选与等长错误材料返回同形业务失败时，不支持 provider 接受事实。"
    },
    {
      "id": "http-success-only",
      "description": "HTTP 2xx 但官方业务码、签名或认证语义失败时不能证明凭据有效。"
    }
  ],
  "control_gap": {
    "expected_control": "服务端 Secret 不进入公开制品，按应用身份绑定并定期轮换；provider 对错误材料执行明确拒绝。",
    "suspected_missing_control": "服务端认证材料被发布到客户端或公开制品，且当前仍被第三方官方控制面接受。",
    "impact_boundary": "这是迁移验证契约；候选被只读或 validate-only 端点接受最多证明当前认证能力，不外推消息发送、广播、支付、账号接管、设备控制或批量影响。"
  },
  "request_matrix": [
    {
      "id": "equal-length-wrong-secret",
      "variant": "negative-control",
      "auth_context": "synthetic-invalid-credential",
      "mutation": "same-format-and-length-invalid-material",
      "expected_observation": "官方端点明确返回签名或认证失败语义。"
    },
    {
      "id": "candidate-secret",
      "variant": "candidate-probe",
      "auth_context": "restricted-candidate-reference",
      "mutation": "candidate-material-only",
      "expected_observation": "只有官方业务成功语义与负控稳定可区分时支持接受事实。"
    },
    {
      "id": "readonly-protected-check",
      "variant": "readback",
      "auth_context": "ephemeral-provider-context",
      "mutation": "one-readonly-or-validate-only-action",
      "expected_observation": "得到无副作用的受保护成功语义，不触达真实用户或设备。"
    },
    {
      "id": "synthetic-target-control",
      "variant": "negative-control",
      "auth_context": "same-candidate-reference",
      "mutation": "high-entropy-nonexistent-business-target",
      "expected_observation": "业务目标不存在不应掩盖认证层候选与错误材料的差分。"
    }
  ],
  "false_positive_filters": [
    "公开 AppKey、client identifier、验证码标识或 SDK license 不属于服务端 Secret。",
    "候选与等长错误材料出现同形响应时不得声称第三方接受。",
    "HTTP 2xx、统一 provider 错误或无效业务目标不能替代认证成功语义。",
    "短期令牌被签发但没有无副作用受保护检查时，只能记录认证候选。"
  ],
  "evidence_invariants": [
    "候选与负控使用相同应用身份、请求体、合成目标、时间窗口和 provider 端点。",
    "候选原值和短期令牌只在受限证据或内存中处理，可复用案例仅记录类型、长度和不可逆指纹。",
    "不调用真实发送、广播、组播、支付、设备控制或其它写接口。",
    "首次出现官方接受语义即停止，并把当前事实与潜在能力上限分开记录。"
  ],
  "stop_conditions": [
    "候选材料首次被官方只读或 validate-only 端点稳定接受后立即停止。",
    "端点可能触达真实用户、设备、资金或产生写入时立即停止。",
    "无法区分公开 AppKey 与服务端 Secret，或候选与负控同形时停止并降级。"
  ],
  "rollback": {
    "required": false,
    "method": "不产生服务端业务状态；立即丢弃本次短期令牌和内存中的候选原值，仅保留不可逆指纹。",
    "success_criteria": "没有发送、广播、写入或控制动作，可复用材料中不存在任何可重放秘密。"
  },
  "sources": [
    {
      "source_alias": "upgrade-plan-case-family",
      "relative_path": "CYBERTEST-CAPABILITY-UPGRADE-PLAN.md",
      "sha256": "39646742f5eae816f44db758ef34b51d2e8472e3579ced6943d3f0f3cf247203",
      "selection": "使用 Third-Party Secret Validation 家族规定的等长错误材料、只读或 validate-only 请求和令牌立即丢弃。"
    },
    {
      "source_alias": "anonymous-retrospective-index",
      "relative_path": "agent/retrospectives/index.md",
      "sha256": "18c94db6f732dd703c06d2f1fc442c20a40463cf36385e14b002a1e223bcd7ca",
      "selection": "选择包含候选服务端 Secret、合成资源标识、provider 接受边界以及所有者日志与轮换收束的匿名摘要。"
    }
  ],
  "anonymization_check": {
    "status": "passed",
    "checked_on": "2026-07-24",
    "target_identifiers_removed": true,
    "replayable_secrets_removed": true,
    "personal_paths_removed": true,
    "placeholder_only": true,
    "scanner": "tool/scan_reusable_knowledge_leaks.py"
  }
}
